{
  "$schema": "https://json-schema.org/draft/2020-12/schema",
  "$id": "https://scalar.com/schemas/release-notes.schema.json",
  "title": "Scalar release notes",
  "type": "array",
  "items": {
    "type": "object",
    "properties": {
      "version": {
        "type": "string",
        "pattern": "^\\d+\\.\\d+\\.\\d+(?:-[\\w.]+)?(?:\\+[\\w.]+)?$",
        "description": "Semver-style version string for the release (for example `3.5.1`)."
      },
      "date": {
        "type": "string",
        "pattern": "^\\d{4}-\\d{2}-\\d{2}$",
        "description": "Release date in ISO `YYYY-MM-DD` format."
      },
      "title": {
        "type": "string",
        "minLength": 1,
        "maxLength": 120,
        "description": "Short, sentence-case headline summarizing the release."
      },
      "content": {
        "description": "Body copy and rich blocks after the headline: `paragraph` for intro text, `list` for bullet highlights, then headings, media, and optional `href` blocks (for example full release notes).",
        "maxItems": 40,
        "type": "array",
        "items": {
          "oneOf": [
            {
              "type": "object",
              "properties": {
                "type": {
                  "type": "string",
                  "const": "paragraph",
                  "description": "Discriminator for the paragraph block type."
                },
                "text": {
                  "type": "string",
                  "minLength": 1,
                  "maxLength": 2000,
                  "description": "Plain-text paragraph copy. Use multiple paragraph blocks for multi-paragraph notes."
                }
              },
              "required": [
                "type",
                "text"
              ],
              "additionalProperties": false,
              "description": "A free-form paragraph rendered between other content blocks."
            },
            {
              "type": "object",
              "properties": {
                "type": {
                  "type": "string",
                  "const": "heading",
                  "description": "Discriminator for the heading block type."
                },
                "text": {
                  "type": "string",
                  "minLength": 1,
                  "maxLength": 120,
                  "description": "Subsection heading shown inside the release entry."
                },
                "level": {
                  "description": "Heading level. Defaults to 3 (rendered below the release title).",
                  "anyOf": [
                    {
                      "type": "number",
                      "const": 3
                    },
                    {
                      "type": "number",
                      "const": 4
                    }
                  ]
                }
              },
              "required": [
                "type",
                "text"
              ],
              "additionalProperties": false,
              "description": "A subsection heading inside a release entry."
            },
            {
              "type": "object",
              "properties": {
                "type": {
                  "type": "string",
                  "const": "list",
                  "description": "Discriminator for the list block type."
                },
                "items": {
                  "minItems": 1,
                  "maxItems": 20,
                  "type": "array",
                  "items": {
                    "type": "string",
                    "minLength": 1,
                    "maxLength": 280,
                    "description": "A single-sentence list item."
                  },
                  "description": "Bullet items rendered as a list. Keep each item to a single sentence."
                },
                "ordered": {
                  "description": "Render as a numbered list when `true`. Defaults to a bullet list.",
                  "type": "boolean"
                }
              },
              "required": [
                "type",
                "items"
              ],
              "additionalProperties": false,
              "description": "A bullet (or numbered) list of single-sentence items."
            },
            {
              "type": "object",
              "properties": {
                "type": {
                  "type": "string",
                  "const": "image",
                  "description": "Discriminator for the image block type."
                },
                "src": {
                  "type": "string",
                  "format": "uri",
                  "description": "Absolute URL of the image asset."
                },
                "alt": {
                  "type": "string",
                  "minLength": 1,
                  "maxLength": 280,
                  "description": "Accessibility text. Required - describe what the image shows."
                },
                "caption": {
                  "description": "Optional caption rendered beneath the image.",
                  "type": "string",
                  "minLength": 1,
                  "maxLength": 280
                },
                "width": {
                  "description": "Optional natural width of the image in pixels. Helps the layout reserve space before the image loads.",
                  "type": "integer",
                  "exclusiveMinimum": 0,
                  "maximum": 9007199254740991
                },
                "height": {
                  "description": "Optional natural height of the image in pixels. Helps the layout reserve space before the image loads.",
                  "type": "integer",
                  "exclusiveMinimum": 0,
                  "maximum": 9007199254740991
                }
              },
              "required": [
                "type",
                "src",
                "alt"
              ],
              "additionalProperties": false,
              "description": "An inline image. Provide alt text for accessibility and an optional caption rendered beneath."
            },
            {
              "type": "object",
              "properties": {
                "type": {
                  "type": "string",
                  "const": "video",
                  "description": "Discriminator for the video block type."
                },
                "src": {
                  "type": "string",
                  "format": "uri",
                  "description": "Absolute URL of an MP4/WebM video asset (self-hosted works best)."
                },
                "poster": {
                  "description": "Optional URL of a poster image shown before the video starts playing.",
                  "type": "string",
                  "format": "uri"
                },
                "caption": {
                  "description": "Optional caption rendered beneath the video.",
                  "type": "string",
                  "minLength": 1,
                  "maxLength": 280
                },
                "autoplay": {
                  "description": "When `true`, the video starts playing as soon as it is rendered. Pair with `muted: true`.",
                  "type": "boolean"
                },
                "loop": {
                  "description": "When `true`, the video loops back to the start when it ends.",
                  "type": "boolean"
                },
                "muted": {
                  "description": "When `true`, the video is muted. Required for autoplay to work in modern browsers.",
                  "type": "boolean"
                },
                "controls": {
                  "description": "When `true`, native playback controls are shown. Defaults to `true` when omitted.",
                  "type": "boolean"
                }
              },
              "required": [
                "type",
                "src"
              ],
              "additionalProperties": false,
              "description": "An inline video clip. Self-hosted MP4/WebM URLs work best - autoplay clips should also set `muted: true`."
            },
            {
              "type": "object",
              "properties": {
                "type": {
                  "type": "string",
                  "const": "href",
                  "description": "Discriminator for an outbound URL block."
                },
                "href": {
                  "type": "string",
                  "format": "uri",
                  "description": "Destination URL (opened in a new tab)."
                },
                "label": {
                  "type": "string",
                  "minLength": 1,
                  "maxLength": 120,
                  "description": "Accessible link text (for example \"Read full release notes\")."
                }
              },
              "required": [
                "type",
                "href",
                "label"
              ],
              "additionalProperties": false,
              "description": "Call-to-action link (for example to full release notes on GitHub)."
            }
          ],
          "description": "Rich content block rendered inside a release note (paragraph, heading, list, image, video, or href)."
        }
      }
    },
    "required": [
      "version",
      "date",
      "title"
    ],
    "additionalProperties": false,
    "description": "A single curated release note rendered in the \"What's new\" modal."
  },
  "description": "Curated, user-facing release notes for the Scalar app. Newest entry first."
}
