[
  {
    "version": "1.0.13",
    "date": "2026-05-14",
    "title": "Scalar Client 1.0 — team workspaces, registry sync, conflict resolution, and a rebuilt experience",
    "content": [
      {
        "type": "video",
        "src": "https://cdn.scalar.com/scalar-app/changelog/1.0.10/video.mp4",
        "caption": "Intro walkthrough — What's new in Scalar Client 1.0",
        "autoplay": true,
        "loop": true,
        "muted": true,
        "controls": true
      },
      {
        "type": "paragraph",
        "text": "Scalar Client 1.0 is the first major release of the open-source HTTP client as a focused desktop and web app. Workspaces are now built around teams and the Scalar Registry: you can sync in real time, resolve conflicts when edits diverge, and manage API descriptions and versions without leaving the client. Local workspaces stay fast and offline-friendly with explicit save and revert before anything ships upstream."
      },
      {
        "type": "heading",
        "text": "Team workspaces and Scalar Registry",
        "level": 3
      },
      {
        "type": "image",
        "src": "https://cdn.scalar.com/scalar-app/changelog/1.0.10/team.png",
        "alt": "Team workspaces and Scalar Registry",
        "caption": "Team workspaces and Scalar Registry"
      },
      {
        "type": "list",
        "items": [
          "First-class team workspaces with a stable team identity that survives slug renames on the server.",
          "Live sync with the Scalar Registry so shared API descriptions stay aligned across machines.",
          "Conflict detection and resolution when local edits and registry changes disagree.",
          "Team switching from the header menu, with routing that follows the active team after sign-in.",
          "Returning to a workspace restores the tabs and routes you had open last time."
        ],
        "ordered": false
      },
      {
        "type": "heading",
        "text": "Local workspaces",
        "level": 3
      },
      {
        "type": "image",
        "src": "https://cdn.scalar.com/scalar-app/changelog/1.0.10/local.png",
        "alt": "Local workspaces",
        "caption": "Local workspaces"
      },
      {
        "type": "list",
        "items": [
          "Save and revert flows for local-only drafts so you can experiment safely before publishing.",
          "Clear separation between personal local workspaces and team-backed workspaces.",
          "IndexedDB-backed persistence with a migration path from older localStorage installs."
        ],
        "ordered": false
      },
      {
        "type": "heading",
        "text": "Registry from the client",
        "level": 3
      },
      {
        "type": "image",
        "src": "https://cdn.scalar.com/scalar-app/changelog/1.0.10/versions.png",
        "alt": "Registry from the client",
        "caption": "Registry from the client"
      },
      {
        "type": "list",
        "items": [
          "Add, update, and remove API descriptions tied to the registry without switching tools.",
          "Create and manage document versions from the same UI you use to send requests.",
          "Integrated registry adapter so the client speaks the same contracts as the hosted product."
        ],
        "ordered": false
      },
      {
        "type": "heading",
        "text": "Client shell, layout, and polish",
        "level": 3
      },
      {
        "type": "list",
        "items": [
          "Layout tuned for small screens: breadcrumbs tuck away, workspace switching moves into the menu, and the address bar stacks cleanly with send actions.",
          "Command palette surfaces inline validation instead of silently disabling invalid actions.",
          "Electron window transparency and splash handling so team workspace reloads and resize flashes feel steadier.",
          "Monaco editor bundling moved to ESM-aligned workers for a more reliable desktop build."
        ],
        "ordered": false
      },
      {
        "type": "href",
        "href": "https://github.com/scalar/scalar/blob/main/projects/scalar-app/CHANGELOG.md",
        "label": "Read the full changelog on GitHub"
      }
    ]
  }
]
